{
  "schemaVersion": "RoadmapFreshnessCoverage 0.1",
  "projectState": {
    "baseHash": "84db7974abbe72b45a4d788e01c69cdba4d1e83ff22aca3736e17ea2931e7a12",
    "currentHash": "215349769ee0240f3682ea768e0d033224023372847ac752710ca67fa81a0169",
    "changedFields": [
      "development.checkpoint",
      "development.nextTransition"
    ]
  },
  "consumers": [
    {
      "path": "docs/plans/autonomous-evolution-roadmap-2026-08.md",
      "disposition": "NO_CHANGE",
      "contentHash": "1906d91c0cd7caa232831d218cba8f10b025e9883d37975d872396a1e5c5f9f5"
    }
  ],
  "readOnly": true,
  "semanticAuthority": false,
  "authorizesMutation": false
}
